headline,body,byline,publishAt,scrapedDate
"Congress, Paralyzed on a Stimulus Deal, Gives Itself Another Week to Strike One","

WASHINGTON — After months of fruitless haggling and a frenzied few days of revived talks, Congress missed yet another deadline on Friday to deliver an economic stimulus package to help struggling Americans weather the pandemic, instead agreeing to extend government funding for an additional week as leaders continued to search for a deal.The Senate approved a one-week stopgap bill to keep federal spending flowing until next Friday, securing additional time for negotiators to hammer out both a catchall spending package and an elusive coronavirus aid compromise that has divided them since summertime. Leaders have said they planned to merge the two packages should agreement be reached.While President Trump signed the temporary funding bill and kept the government from shutting down, it remained unclear whether seven days would be enough for lawmakers to complete the dozen must-pass annual spending bills and break through their impasse over providing relief to millions of Americans, small businesses and schools and funding efforts to distribute a vaccine.Time is waning for lawmakers to resolve policy divisions, with a number of government programs and policies that are helping insulate millions of Americans from the economic consequences of the pandemic set to expire in the coming weeks. An estimated 12 million workers could lose jobless benefits when two federal programs that expand and extend the unemployment insurance system expire this month, and a federal moratorium on evictions lapses on Dec. 31 without administrative action.

Support for the stopgap measure, which overwhelmingly passed the House on Wednesday, was widespread enough in the Senate that it ultimately passed by voice vote. But the private wrangling before the vote on Friday forecast how difficult it will be for lawmakers to strike an agreement on the first infusion of pandemic relief since April and the broader funding package.An unlikely bipartisan pair, Senators Bernie Sanders, independent of Vermont, and Josh Hawley, Republican of Missouri, warned that they planned to try to force a vote on legislation that would send another round of $1,200 checks to Americans if that provision was left out of a deal, with Mr. Hawley promising “an interesting week” ahead in the Senate.“If I have anything to say about it — and I guess I do — we’re not going to go home for the Christmas holidays unless we make sure that we provide for the millions of families in this country who are suffering,” Mr. Sanders said on the Senate floor.Senator Mike Braun, Republican of Indiana, had also resisted voting on the stopgap bill without the promise of a vote on a measure to end the threat of government shutdowns, and it was unclear if he and other conservative allies would try another blockade.Lawmakers and aides planned to work through the weekend to haggle over a stimulus plan and the broader spending package. Signaling that the negotiations could bleed into the holidays, Speaker Nancy Pelosi of California noted on Thursday that Congress had previously worked through Christmas in the absence of an agreement.

An omnibus package may include legislation that would end the practice of “surprise medical billing,” which is when a patient is unexpectedly treated by a doctor who does not take their insurance, after top lawmakers reached a bipartisan, bicameral agreement.The current proposal would protect patients from surprise bills, and would require insurers and medical providers who cannot agree on a payment rate to use an outside arbitrator, who would determine a payment amount based partly on what other doctors and hospitals are typically paid for similar services.Ms. Pelosi said in a statement Friday night that the House planned to push for the legislation to be included in a final spending package.But on the matter of providing additional pandemic relief, the two policy divides that have long impaired a deal — Republicans’ insistence on sweeping coronavirus liability protections and Democrats’ demands to provide an infusion of federal funds of states and cities facing fiscal crises — remain sticking points.Democrats and some Republicans have argued that providing another round of relief for cash-short state and local governments is critical to avoid laying off city workers. But many Republicans have derided the proposal as a so-called blue-state bailout that could be used to close pre-existing budget shortfalls that were a result of mismanagement, not the economic fallout from the pandemic. Democrats have likewise warned that a sweeping liability shield prioritized by Republicans is a nonstarter, arguing that there has not been a surge in lawsuits related to the pandemic, and offering blanket protections against such suits would serve only to weaken worker protections.Senator Mitch McConnell, Republican of Kentucky and the majority leader, has suggested jettisoning both provisions to get a swift agreement on a narrower package that would include funding vaccine distribution and the Paycheck Protection Program, a popular loan program for small businesses. But some lawmakers are reluctant to resort to that, citing the urgency of addressing the toll of the pandemic.“These problems don’t go away,” said Senator Lisa Murkowski, Republican of Alaska, who is part of the group that is working on a bipartisan $908 billion compromise framework. “If anything, they just get bigger. So if we can just stick to it, get a proposal that we can advance that resolves not only goals like unemployment, P.P.P., food security, but also the state and local and tribal and the liability issue — this is what we’ve been working on. This is what we need to keep doing.”

President-elect Joseph R. Biden Jr. again signaled his support for a smaller relief package on Friday, saying at an event in Wilmington, Del., that “this relief package won’t be the total answer even if it gets passed, but it’s an important first step.”But the $908 billion framework that moderate lawmakers have labored over remains unfinished even after days of private meetings and negotiations. Senator Chris Coons, Democrat of Delaware, told reporters that “it is proving to be extremely difficult to close” the gap on liability protections.Should a final agreement and legislative text emerge, it is expected to include some form of limited legal protection for coronavirus-related lawsuits, $160 billion in state and local funding, billions of dollars for schools, businesses and vaccine distribution, and $300-a-week supplemental federal jobless payments until the spring.The proposal, for now, does not include direct payments in the form of stimulus checks. But Senator John Thune of South Dakota, the No. 2 Republican, suggested that in exchange for removing funding for state and local governments, a compromise plan could include another round of direct payments.“You wouldn’t be able to get as much as they’re talking about, but it would still be a pretty significant direct payment to people out there,” Mr. Thune said as he left the Capitol. “I think there’s a whole range of things that both sides agree on, and we ought to do today what we can agree on, and leave the other issues for another day.”Ben Casselman contributed reporting from New York, and Thomas Kaplan and Margot Sanger-Katz from Washington.",Emily Cochrane,"Dec. 11, 2020",2020-12-17 02:19:52.195422
"Staring Down Deadline, Congress Nears $900 Billion Stimulus Deal","

WASHINGTON — After months of stalemate, congressional leaders were on the verge on Wednesday of cementing a roughly $900 billion stimulus deal to deliver emergency aid to individuals and companies devastated by the toll of the worsening pandemic, racing to finish the details and stave off a government shutdown on Friday.The measure, which has been under discussion for months as the coronavirus has ravaged the economy, is expected to provide a new round of direct payments to millions of Americans as well as additional unemployment benefits, food assistance and rental aid. It would prop up sputtering businesses with federally backed loans and provide funding for schools, hospitals and the distribution of a just-approved vaccine.While the agreement was not yet final, Republicans and Democrats alike signaled that they were ready to coalesce around the main elements, marking an extraordinary shift from just weeks ago, when both sides were issuing ultimatums and refusing to budge from long-held positions.It was unclear when a final agreement would be reached, as lawmakers and staff haggled over what Representative Kevin McCarthy of California, the Republican leader, referred to as “just the fine details we’ve got to get done.”

“We’ll be ready when we’re ready,” Speaker Nancy Pelosi of California told reporters. “A lot of writing goes into it and the rest.”The momentum on Wednesday, however, indicated that relief could soon be on its way for individuals and businesses who have waited for months as economists have clamored for another robust infusion of federal aid, warning that Congress’s failure to act could do long-lasting damage.“We’re making good progress,” said Senator Chuck Schumer of New York, the Democratic leader, in a brief interview on Wednesday afternoon as staff exchanged offers and counteroffers. “No one gets everything they want, but we’re feeling pretty good.”But even as lawmakers moved toward striking an elusive deal, the package pointed to troubles on the horizon for President-elect Joseph R. Biden Jr., who had pressed for at least some compromise on emergency pandemic aid before year’s end. To break the logjam, Democrats appeared to have dropped their demand for a dedicated funding stream for states and cities that are facing fiscal ruin, guaranteeing that Mr. Biden will have to act early in his tenure to try to bolster them and take additional action to prop up the economy.“The stimulus package is encouraging,” Mr. Biden said Wednesday at an event in Wilmington, Del. “But it’s a down payment — an important down payment on what’s going to have to be done beginning the end of January into February. But it’s very important to get done.”

For months, Democrats and Republicans had been unwilling to compromise amid a toxic presidential election. Democrats, who initially pushed a $3.4 trillion plan, held out for a much broader package than Republicans were willing to consider in the run-up to the November election, judging that President Trump and his party would pay a political price for failing to agree to a generous new batch of aid.Republicans, for their part, were wary of any new federal spending and insisted on a much narrower plan that would extend sweeping coronavirus liability protections. They appeared to have put that demand aside in recent days in exchange for Democrats backing off their insistence on a large new infusion of state and local assistance. (Two officials familiar with the talks said there were other avenues to potentially provide the aid.)But the political calculus changed after the election. Mr. Biden and his advisers began quietly pressing for Democrats to strike a deal — even a scaled-down one — and Senator Mitch McConnell, Republican of Kentucky and the majority leader, had powerful reasons of his own to compromise. On Wednesday, he suggested on a private call with Republicans that delivering the stimulus package could bolster the party’s hopes of hanging onto its majority in the Senate, according to three people who relayed his comments on the condition of anonymity.Mr. McConnell said that Senators Kelly Loeffler and David Perdue, who are both facing runoffs in January that will determine which party controls the Senate, were “getting hammered” for Congress’s failure to deliver more pandemic aid to struggling Americans — particularly the direct payments — and that enacting the measure could help them. The majority leader also emphasized that the package could be signed by Mr. Trump, who has pushed for another round of stimulus checks.The Coronavirus Outbreak ›Latest UpdatesUpdated Dec. 16, 2020, 7:32 p.m. ETA happy surprise as vaccine vials turn out to hold more than thought.Chris Christie, reflecting on his own coronavirus experience, releases a video urging people to wear masks.How good is that mask you’re wearing? You may soon find out.Even as enthusiasm built that the long-stalled stimulus talks were finally bearing fruit, it was clear that the potential agreement was far smaller than what economists say is needed.The plan under discussion amounts to less than half of the $2.2 trillion stimulus law enacted in March, and it does not come close to matching what many economists had said would be necessary to jolt the economy out of a pandemic-induced slump. They have warned for months about permanent economic damage and deteriorating prospects for a swift recovery, offering a grim backdrop as lawmakers traded blame.Jerome H. Powell, the chair of the Federal Reserve, reiterated his call for more fiscal stimulus on Wednesday, saying that the continuing rise in Covid-19 cases and the lapse in funding for several programs that were helping households and businesses stay afloat posed challenges for the economy.

“The case for fiscal policy right now is very, very strong, and I think that’s widely understood right now,” he said. “Now that we can kind of see the light at the end of the tunnel, it would be bad to see people losing their business, their life’s work, even generations’ worth of work.”Even as negotiations continued, there was evidence of economic harm the worsening pandemic was causing. Retail sales fell 1.1 percent in November, the Commerce Department reported, with restaurants and bars experiencing even bigger declines as states reimposed business restrictions.Other measures of economic activity have likewise slowed in recent weeks, and applications for unemployment benefits have surged. For the millions of Americans already relying on jobless benefits, the situation could be even more dire if two programs that expand and extend the unemployment insurance system expire after next week without congressional action.Republicans have continued to insist that a package should remain under $1 trillion in order to maintain support within their ranks, leaving lawmakers and staff to wrangle over funding levels for various provisions and programs in the new measure. Ms. Pelosi and Mr. Schumer spoke with Steven Mnuchin, the Treasury secretary, for about 45 minutes on Wednesday as they worked to hammer out final details.The measure, which builds off a $748 billion bill proposed by a bipartisan group of moderates this week, is expected to include $25 billion to establish a program that would provide emergency rental assistance to families affected by the pandemic, as well as billions for vaccine development and distribution, broadband and schools across the country.Negotiators were still discussing the possible inclusion of House legislation that provides funds to distribute to states and cities and to fully cover the costs of emergency work during the pandemic. They were also still haggling over an expansion and extension of unemployment benefits and how long they would last. The agreement is expected to revive lapsed enhanced unemployment benefits at about $300 a week, half of the original benefit approved in March, which lapsed over the summer. But Republicans were insisting on curtailing the number of weeks of benefits to help offset the cost of providing stimulus payments.In addition to the jobless aid, the plan would provide a one-time direct payment to Americans, expected to be about $600 per person, also half the amount provided under the March stimulus law.

Senator Bernie Sanders, independent of Vermont, who has been vocal about his belief that Democrats succumbed too easily to Republican demands, and Senator Joe Manchin III, Democrat of West Virginia, a leader of the bipartisan group, got into a heated exchange on a private Democratic caucus call over progressives’ push to increase the amount of the direct payments, according to three people familiar with the discussion.“It will be a progressive holding their nose and voting for something because we don’t want to take away $600 from American families before Christmas and we don’t want to take unemployment benefits away from people,” said Representative Ro Khanna, Democrat of California.The measure is likely to advance as part of a catchall spending package that will include the dozen annual bills needed to fund the government through the end of the fiscal year. Among the unresolved issues was whether to include a bipartisan, bicameral agreement on legislation that would end the practice of surprise medical billing.“I’m cautiously optimistic that maybe we will be able to finish up by the end of this week,” said Senator Susan Collins, Republican of Maine and one of the key lawmakers involved in drafting the bipartisan proposal.But Mr. McConnell warned Republicans in the private conference call to prepare to remain in Washington through the weekend as lawmakers and aides finish the details and write legislative text.Reporting was contributed by Nicholas Fandos and Ben Casselman from New York, and Catie Edmondson, Thomas Kaplan and Jeanna Smialek from Washington.",Emily Cochrane,"Dec. 16, 2020",2020-12-17 02:19:55.184014
