headline,body,byline,publishAt,scrapedDate
Vaccination Campaign at Nursing Homes Faces Obstacles and Confusion,"

In coming days, squads of CVS and Walgreens employees, clad in protective gear and carrying small coolers, will begin to arrive at tens of thousands of nursing homes and assisted-living facilities to vaccinate staff and residents against the coronavirus.It promises to be a crucial milestone in America’s battle against a pandemic that has inflicted especially severe carnage on nursing homes. At least 106,000 residents and staff of long-term care facilities have died from the virus, accounting for 38 percent of the country’s Covid-related fatalities.But even before it begins, the mass-vaccination campaign is facing serious obstacles that are worrying nursing home executives, industry watchdogs, elder-care lawyers and medical experts. They expect nursing homes to be the most challenging front in the mission to vaccinate Americans.

Some residents and staff are balking at taking the vaccine. Short-staffed facilities are concerned about workers calling in sick with side effects, straining resources just as some frail residents are likely to experience fever and fatigue from the shot. Most nursing home employees work in shifts; will it be possible to vaccinate everyone over the course of just a few visits from CVS and Walgreens?

While some states began vaccinations in nursing homes this week, the broader nationwide effort will start over the next few days. And there remains widespread confusion about a key element: how nursing homes will get consent to vaccinate residents who aren’t able to make their own medical decisions. A CVS executive said such residents’ legal representatives will be able to provide consent to nursing homes electronically or over the phone, but officials at multiple large nursing home chains said they weren’t aware of that.If residents or their representatives haven’t given consent before CVS or Walgreens employees show up, it is not clear whether or when they will have another chance to be inoculated.“Given the pace of this rollout, I am very concerned that nursing facilities won’t have the time or capacity to really explain the vaccine to residents and their families,” said Nicole Howell, a state-funded ombudsman in California whose office works with 29,000 long-term care residents.

Pharmacists from Walgreens are scheduled to arrive next week at the 460-bed Gurwin Jewish Nursing & Rehabilitation Center in Commack, N.Y., to begin vaccinations. Employees, residents and their families have been peppering Stuart Almer, the home’s chief executive, with questions. Can residents and staff orally agree to receive the vaccine or will they have to sign something? What role, if any, will nursing home employees play in vaccinating residents?Mr. Almer said he has spent hours on the phone with federal and state agencies but has few answers.“We still don’t know very much,” he said.Executives from CVS and Walgreens said in interviews that they have been planning the vaccination campaign for months and are confident it will work. “If there are concerns or challenges, we certainly are open to work with facilities to try to minimize any disruption that they may have,” said Rick Gates, a Walgreens executive leading the company’s planning.

Dr. David Gifford, chief medical officer for the American Health Care Association/National Center for Assisted Living, which represents nursing homes and similar facilities, said most long-term care providers seem to be getting the information they need about the vaccination effort.Still, he said, “this is a rapidly changing situation, and constant, clear communication from everyone is critical to make sure this program runs smoothly.”The federal government has agreements with CVS and Walgreens to send pharmacists and support staff to vaccinate residents and staff at thousands of long-term care facilities such as nursing homes and assisted-living communities.

More than 40,000 facilities have opted to work with CVS. Nearly 35,000 chose Walgreens. It is up to each state to pick whether to have the pharmacies use vaccines made by Pfizer or Moderna (whose vaccine the Food and Drug Administration plans to authorize on Friday) at all its long-term care facilities.ImageThe handheld cooler bags that CVS employees will use to bring vaccine doses from pharmacies to nursing homes.Credit...CVSSome states are starting vaccinations in their nursing homes this week, but the campaign led by CVS and Walgreens won’t begin in earnest until Monday. In some states, it won’t begin until the end of the month or January.Because of the large number of facilities they must visit, CVS and Walgreens only have the capacity to go to each location two or three times. The Pfizer and Moderna vaccines both require two doses, separated by a few weeks, which means that at most nursing homes, all staff and residents will have to receive their shots on the same days.Chris Cox, the CVS executive in charge of planning the vaccine effort, said that if the company hears from nursing homes worried that three visits won’t be enough, it will deal with those concerns “on a case-by-case basis.”Covid-19 Vaccines ›Answers to Your Vaccine QuestionsWith distribution of a coronavirus vaccine beginning in the U.S., here are answers to some questions you may be wondering about:If I live in the U.S., when can I get the vaccine? While the exact order of vaccine recipients may vary by state, most will likely put medical workers and residents of long-term care facilities first. If you want to understand how this decision is getting made, this article will help.When can I return to normal life after being vaccinated? Life will return to normal only when society as a whole gains enough protection against the coronavirus. Once countries authorize a vaccine, they’ll only be able to vaccinate a few percent of their citizens at most in the first couple months. The unvaccinated majority will still remain vulnerable to getting infected. A growing number of coronavirus vaccines are showing robust protection against becoming sick. But it’s also possible for people to spread the virus without even knowing they’re infected because they experience only mild symptoms or none at all. Scientists don’t yet know if the vaccines also block the transmission of the coronavirus. So for the time being, even vaccinated people will need to wear masks, avoid indoor crowds, and so on. Once enough people get vaccinated, it will become very difficult for the coronavirus to find vulnerable people to infect. Depending on how quickly we as a society achieve that goal, life might start approaching something like normal by the fall 2021.If I’ve been vaccinated, do I still need to wear a mask? Yes, but not forever. Here’s why. The coronavirus vaccines are injected deep into the muscles and stimulate the immune system to produce antibodies. This appears to be enough protection to keep the vaccinated person from getting ill. But what’s not clear is whether it’s possible for the virus to bloom in the nose — and be sneezed or breathed out to infect others — even as antibodies elsewhere in the body have mobilized to prevent the vaccinated person from getting sick. The vaccine clinical trials were designed to determine whether vaccinated people are protected from illness — not to find out whether they could still spread the coronavirus. Based on studies of flu vaccine and even patients infected with Covid-19, researchers have reason to be hopeful that vaccinated people won’t spread the virus, but more research is needed. In the meantime, everyone — even vaccinated people — will need to think of themselves as possible silent spreaders and keep wearing a mask. Read more here.Will it hurt? What are the side effects? The Pfizer and BioNTech vaccine is delivered as a shot in the arm, like other typical vaccines. The injection into your arm won’t feel different than any other vaccine, but the rate of short-lived side effects does appear higher than a flu shot. Tens of thousands of people have already received the vaccines, and none of them have reported any serious health problems. The side effects, which can resemble the symptoms of Covid-19, last about a day and appear more likely after the second dose. Early reports from vaccine trials suggest some people might need to take a day off from work because they feel lousy after receiving the second dose. In the Pfizer study, about half developed fatigue. Other side effects occurred in at least 25 to 33 percent of patients, sometimes more, including headaches, chills and muscle pain. While these experiences aren’t pleasant, they are a good sign that your own immune system is mounting a potent response to the vaccine that will provide long-lasting immunity.Will mRNA vaccines change my genes? No. The vaccines from Moderna and Pfizer use a genetic molecule to prime the immune system. That molecule, known as mRNA, is eventually destroyed by the body. The mRNA is packaged in an oily bubble that can fuse to a cell, allowing the molecule to slip in. The cell uses the mRNA to make proteins from the coronavirus, which can stimulate the immune system. At any moment, each of our cells may contain hundreds of thousands of mRNA molecules, which they produce in order to make proteins of their own. Once those proteins are made, our cells then shred the mRNA with special enzymes. The mRNA molecules our cells make can only survive a matter of minutes. The mRNA in vaccines is engineered to withstand the cell's enzymes a bit longer, so that the cells can make extra virus proteins and prompt a stronger immune response. But the mRNA can only last for a few days at most before they are destroyed.Nursing homes are now diving into the mundane but crucial details about what will actually happen — and where — when the pharmacists show up with vaccines.At Genesis, the largest nursing chain in the United States, teams from CVS will vaccinate workers in common areas, while residents will be vaccinated in their own rooms.

“We don’t like to bring residents together into large groups because that can worsen any potential outbreak,” said Dr. Richard Feifer, the chain’s chief medical officer.Complicating the task, some nursing-home employees are reluctant to get inoculated, even though Pfizer and Moderna’s vaccines have been found safe and effective during trials involving tens of thousands of people.

“I don’t want to be a guinea pig,” said Sheena Bumpas, a certified nursing assistant at a home in Duncan, Okla.She is far from alone. When the National Association of Health Care Assistants, an advocacy group for caregivers, recently surveyed certified nursing assistants who work in long-term care facilities, nearly 72 percent of respondents said they do not want to receive the vaccine.Lori Porter, the group’s co-founder and chief executive, said employees are also worried about what happens if they experience side effects — some participants in clinical trials experienced mild to moderate side effects — that force them to stay home. Ms. Porter said many nursing assistants had to use sick days to quarantine earlier in the pandemic and now have little or no paid sick leave left for 2020.Nursing home chains like Genesis have started campaigns to inform workers, residents and family members about the importance and safety of getting vaccinated.

“Written letters, emails, PowerPoint presentations, videoconferencing sessions, live face-to-face dialogue, small group, large group broadcasts — we’re doing it all,” Dr. Feifer said.But the more employees who get the vaccine, the more who are likely to experience side effects — and that could cause more problems.“If even as little as 10 percent of your staff calls off the next day — while at the same time all of the residents are irritated, upset and having adverse effects — you’ve created a perfect storm,” said Chad Worz, chief executive of the American Society of Consultant Pharmacists, which represents pharmacies that serve long-term care providers.

Among the biggest remaining challenges, however, is getting the informed consent of residents taking the vaccine.There is no federal requirement for people to give consent before getting vaccinated, but it is standard practice and is often needed for billing purposes. States have different requirements about how medical consent can be given and what information needs to be provided to the person who is consenting. The Centers for Disease Control and Prevention’s guidance is that residents or their representatives should receive a fact sheet about the coronavirus vaccine and then consent to receiving it.The task of getting consent is not always straightforward at nursing homes. Many residents, like those with dementia, aren’t capable of giving it on their own. Instead, nursing homes need to get the permission of their family members or other legal representatives.

CVS and Walgreens have created paper and digital consent forms that nursing homes can use. Consent must be given in advance; the pharmacies need to know how many doses of the vaccine, which must be kept very cold, to bring with them.There’s significant confusion among nursing homes about getting consent, especially when it involves representatives who aren’t physically at the nursing home and can’t come because of concerns about spreading the virus. Will an email suffice? What about consent over the phone? Or will consent forms have to be signed, either in hard copy or electronically?Mr. Cox, the CVS executive, said the company this week has provided nursing homes with additional guidance on how to get consent. He said he expects most facilities to simply have an employee get consent over the phone from a resident’s medical proxy and then enter it in the person’s medical record. A nursing home employee can then sign the consent form on the resident’s behalf, he said.Even getting over-the-phone or electronic consent in a matter of days could prove time-consuming.Employees at SavaSeniorCare, one of the country’s largest nursing-home chains, don’t think they can start getting consent from residents and staff until they get the forms from CVS. As of Monday, they hadn’t received them, said Annaliese Impink, a SavaSeniorCare executive who is coordinating the vaccine rollout. (T.J. Crawford, a CVS spokesman, said the last batches of paperwork should arrive at nursing homes by Wednesday.)In the meantime, Ms. Impink said, nursing home staff have been calling family members of residents who can’t make their own consent decisions to confirm contact information to quickly get in touch for approval of the vaccination.Cissy Sanders, whose 71-year-old mother has a neurodegenerative disease and lives in a nursing home in Austin, said she has felt pressure to make a quick decision about vaccinating her mother.The administrator of her mother’s nursing home sent her an email on Monday, she said, informing her that the vaccine process was moving swiftly and doses were likely to run out.

“I am not in any way an anti-vaxxer,” she said, “but an email like that is designed to hurry me up, and I want the time to get all the information I can.” Ms. Sanders said she is worried about how the vaccine might affect her mother. (The F.D.A. has said that the only adults who should not get Pfizer’s vaccine are those with histories of severe allergic reactions to ingredients in the vaccine.)Officials at some facilities said they are optimistic about most of their residents agreeing to be vaccinated. Sunrise Senior Living, which operates 275 senior living communities in the United States, last week surveyed its residents and their family members about their willingness to get a Covid-19 vaccine. About 80 percent of respondents said they are definitely willing.At Genesis, which has been building its own electronic system for getting consent from residents’ medical proxies, executives are cautiously hopeful about the start of vaccinations.“It will be challenging; it will be complicated; it may get messy at times. But we’ve got to start quickly and lead the way,” Dr. Feifer said. “We’re going first. That’s a privilege and a responsibility to make sure we get this right.”",Jessica Silver-Greenberg,"Dec. 16, 2020",2020-12-17 02:20:17.273359
